{
  "schemaVersion": 1,
  "datasetVersion": "deterministic-intake-2.0.2",
  "environment": "isolated-local-synthetic-evaluation",
  "groups": [
    {
      "id": "EVAL-01",
      "promoted": true,
      "absoluteOutcomeGate": false,
      "variations": [
        {
          "id": "EVAL-01-ONE-SHOT",
          "turns": [
            {
              "id": "EVAL-01-turn-01",
              "requesterMessage": "I need ProductionReadOnly access to PROD-ALPHA-EU for incident INC-1042. Justification: I am investigating elevated customer errors.",
              "expected": {
                "dialogueAct": "updateDraft",
                "discussionTopic": null,
                "failure": null,
                "proposal": {
                  "environment": { "operation": "set", "environmentReferenceKind": "exactEnvironmentId", "value": "PROD-ALPHA-EU" },
                  "role": { "operation": "set", "environmentReferenceKind": null, "value": "ProductionReadOnly" },
                  "justification": { "operation": "set", "environmentReferenceKind": null, "value": "I am investigating elevated customer errors." },
                  "incident": { "operation": "set", "environmentReferenceKind": null, "value": "INC-1042" }
                },
                "allowedTools": ["get_environment_roles", "get_incident", "get_production_environment"],
                "requiredTools": [],
                "maximumToolCalls": 3
              }
            }
          ],
          "expectedFinal": {
            "outcome": "ready",
            "lifecycle": "ready",
            "candidate": { "clientId": "client-alpha", "environmentId": "PROD-ALPHA-EU", "roleId": "ProductionReadOnly", "justification": "I am investigating elevated customer errors.", "incidentId": "INC-1042" },
            "clarificationTarget": null,
            "clarificationChoiceIds": [],
            "scopeResult": null,
            "justificationResult": null
          }
        }
      ]
    },
    {
      "id": "EVAL-02",
      "promoted": true,
      "absoluteOutcomeGate": false,
      "variations": [
        {
          "id": "EVAL-02-INCREMENTAL",
          "startingState": {
            "candidate": { "clientId": "client-alpha", "environmentId": "PROD-ALPHA-EU", "roleId": "ProductionReadOnly", "justification": "Investigate existing production symptoms.", "incidentId": null },
            "clarification": null
          },
          "turns": [
            {
              "id": "EVAL-02-turn-01",
              "requesterMessage": "Add incident INC-1042 and leave everything else unchanged.",
              "expected": {
                "dialogueAct": "updateDraft",
                "discussionTopic": null,
                "failure": null,
                "proposal": {
                  "incident": { "operation": "set", "environmentReferenceKind": null, "value": "INC-1042" }
                },
                "allowedTools": ["get_incident"],
                "requiredTools": [],
                "maximumToolCalls": 1
              }
            }
          ],
          "expectedFinal": {
            "outcome": "ready",
            "lifecycle": "ready",
            "candidate": { "clientId": "client-alpha", "environmentId": "PROD-ALPHA-EU", "roleId": "ProductionReadOnly", "justification": "Investigate existing production symptoms.", "incidentId": "INC-1042" },
            "clarificationTarget": null,
            "clarificationChoiceIds": [],
            "scopeResult": null,
            "justificationResult": null
          }
        }
      ]
    },
    {
      "id": "EVAL-03",
      "promoted": true,
      "absoluteOutcomeGate": false,
      "variations": [
        {
          "id": "EVAL-03-EN",
          "startingState": {
            "candidate": { "clientId": "client-alpha", "environmentId": "PROD-ALPHA-EU", "roleId": "ProductionReadOnly", "justification": "Investigate deployment symptoms.", "incidentId": "INC-1042" },
            "clarification": null
          },
          "turns": [
            {
              "id": "EVAL-03-EN-turn-01",
              "requesterMessage": "Clear the incident and replace the role with ProductionDeployment.",
              "expected": {
                "dialogueAct": "updateDraft", "discussionTopic": null, "failure": null,
                "proposal": {
                  "role": { "operation": "set", "environmentReferenceKind": null, "value": "ProductionDeployment" },
                  "incident": { "operation": "clear", "environmentReferenceKind": null, "value": null }
                },
                "allowedTools": ["get_environment_roles"], "requiredTools": [], "maximumToolCalls": 1
              }
            }
          ],
          "expectedFinal": {
            "outcome": "ready", "lifecycle": "ready",
            "candidate": { "clientId": "client-alpha", "environmentId": "PROD-ALPHA-EU", "roleId": "ProductionDeployment", "justification": "Investigate deployment symptoms.", "incidentId": null },
            "clarificationTarget": null, "clarificationChoiceIds": [], "scopeResult": null, "justificationResult": null
          }
        }
      ]
    },
    {
      "id": "EVAL-04",
      "promoted": true,
      "absoluteOutcomeGate": false,
      "variations": [
        {
          "id": "EVAL-04-UNIQUE-READABLE",
          "turns": [
            {
              "id": "EVAL-04-turn-01",
              "requesterMessage": "I need read-only access to Client Alpha's primary EU production environment to investigate elevated customer errors.",
              "expected": {
                "dialogueAct": "updateDraft", "discussionTopic": null, "failure": null,
                "proposal": {
                  "environment": { "operation": "set", "environmentReferenceKind": "exactEnvironmentId", "value": "PROD-ALPHA-EU" },
                  "role": { "operation": "set", "environmentReferenceKind": null, "value": "ProductionReadOnly" },
                  "justification": { "operation": "set", "environmentReferenceKind": null, "value": "to investigate elevated customer errors." }
                },
                "allowedTools": ["search_production_environments", "get_environment_roles"],
                "requiredTools": ["search_production_environments", "get_environment_roles"],
                "maximumToolCalls": 2
              }
            }
          ],
          "expectedFinal": {
            "outcome": "ready", "lifecycle": "ready",
            "candidate": { "clientId": "client-alpha", "environmentId": "PROD-ALPHA-EU", "roleId": "ProductionReadOnly", "justification": "to investigate elevated customer errors.", "incidentId": null },
            "clarificationTarget": null, "clarificationChoiceIds": [], "scopeResult": null, "justificationResult": null
          }
        }
      ]
    },
    {
      "id": "EVAL-05",
      "promoted": true,
      "absoluteOutcomeGate": true,
      "variations": [
        {
          "id": "EVAL-05-FIRST",
          "startingState": {
            "candidate": { "clientId": null, "environmentId": null, "roleId": null, "justification": "Investigate production symptoms.", "incidentId": null },
            "clarification": {
              "target": "environment",
              "choices": [
                { "canonicalId": "PROD-ALPHA-EU", "displayName": "Primary Production EU", "clientId": "client-alpha", "clientDisplayName": "Client Alpha", "region": "EU", "classification": "primary" },
                { "canonicalId": "RECOVERY-PROD-ALPHA-EU", "displayName": "Recovery Production EU", "clientId": "client-alpha", "clientDisplayName": "Client Alpha", "region": "EU", "classification": "recovery" }
              ]
            }
          },
          "turns": [
            {
              "id": "EVAL-05-FIRST-turn-01", "requesterMessage": "first",
              "expected": {
                "dialogueAct": "updateDraft", "discussionTopic": null, "failure": null,
                "proposal": { "environment": { "operation": "set", "environmentReferenceKind": "exactEnvironmentId", "value": "PROD-ALPHA-EU" } },
                "allowedTools": ["get_production_environment", "get_environment_roles"], "requiredTools": [], "maximumToolCalls": 2
              }
            }
          ],
          "expectedFinal": {
            "outcome": "clarification", "lifecycle": "collecting",
            "candidate": { "clientId": "client-alpha", "environmentId": "PROD-ALPHA-EU", "roleId": null, "justification": "Investigate production symptoms.", "incidentId": null },
            "clarificationTarget": "role", "clarificationChoiceIds": ["ProductionDeployment", "ProductionReadOnly", "ProductionSupport"],
            "scopeResult": { "kind": "applied", "rejectionReason": null }, "justificationResult": null
          }
        },
        {
          "id": "EVAL-05-OTHER-TWO",
          "startingState": {
            "candidate": { "clientId": null, "environmentId": null, "roleId": null, "justification": "Investigate production symptoms.", "incidentId": null },
            "clarification": {
              "target": "environment",
              "choices": [
                { "canonicalId": "PROD-ALPHA-EU", "displayName": "Primary Production EU", "clientId": "client-alpha", "clientDisplayName": "Client Alpha", "region": "EU", "classification": "primary" },
                { "canonicalId": "RECOVERY-PROD-ALPHA-EU", "displayName": "Recovery Production EU", "clientId": "client-alpha", "clientDisplayName": "Client Alpha", "region": "EU", "classification": "recovery" }
              ]
            }
          },
          "turns": [
            {
              "id": "EVAL-05-OTHER-TWO-turn-01", "requesterMessage": "the other one",
              "expected": {
                "dialogueAct": "updateDraft", "discussionTopic": null, "failure": null,
                "proposal": { "environment": { "operation": "set", "environmentReferenceKind": "exactEnvironmentId", "value": "RECOVERY-PROD-ALPHA-EU" } },